<!ELEMENT curriculum (datosPersonales, contacto, carrera)>
<!ATTLIST curriculum xmlns:xsi CDATA #REQUIRED
            xsi:noNamespaceSchemaLocation CDATA #REQUIRED>

<!ELEMENT datosPersonales (nombre, apellido,nacimineto, residencia)>
<!ELEMENT nombre (#PCDATA)>
<!ELEMENT apellido (#PCDATA)>
<!ELEMENT nacimineto (#PCDATA)>

<!ELEMENT residencia (ciudad, pais)>
<!ELEMENT ciudad (#PCDATA)>
<!ELEMENT pais (#PCDATA)>

<!ELEMENT contacto (telefono, correo, linkedin)>
<!ELEMENT telefono (#PCDATA)>
<!ELEMENT correo (#PCDATA)>
<!ELEMENT linkedin (#PCDATA)>


<!ELEMENT carrera (descripcion, competencias, formaciones, experiencias)>
<!ELEMENT descripcion (#PCDATA)>

<!ELEMENT competencias (competencia)+>
<!ELEMENT competencia (nombreCom, nivel)>
<!ELEMENT nombreCom (#PCDATA)>
<!ELEMENT nivel (#PCDATA)>

<!ELEMENT formaciones (formacion)+>
<!ELEMENT formacion (titulacion, centro, fechaFin)>
<!ELEMENT titulacion (#PCDATA)>
<!ELEMENT centro (#PCDATA)>
<!ELEMENT fechaFin (#PCDATA)>

<!ELEMENT experiencias (experiencia)+>
<!ELEMENT experiencia (puesto, empresa, fechaIni, fechaFinal)>
<!ELEMENT puesto (#PCDATA)>
<!ELEMENT empresa (#PCDATA)>
<!ELEMENT fechaIni (#PCDATA)>
<!ELEMENT fechaFinal (#PCDATA)>
